F1: NOT IN FACILITY
A2: CENSUS FOR | B2: 42337 | F2: IN Count/Out Count | H2: Workers | J2: Furlough | L2: Open Ward | N2: Emerg. Trips | P2: Total | Q2: PREPARED BY | R2: #VALUE!
D5: JUVENILES
B6: MALE | C6: FEMALE | D6: MALE | E6: FEMALE | F6: M | G6: F | H6: M | I6: F | J6: M | K6: F | L6: M | M6: F | N6: M | O6: F | Q6: HOSPITAL | R6: SUBMITTED BY
A7: ASD ASDCU | B7: 102 | C7: 0 | D7: 0 | E7: 0 | F7: 0 | G7: 0 | H7: 0 | I7: 0 | J7: 0 | K7: 0 | L7: 0 | M7: 0 | N7: 0 | O7: 0 | P7: 102 | Q7: 0 | R7: #VALUE!
A8: ASD Cambria | B8: 222 | C8: 0 | D8: 0 | E8: 0 | F8: 0 | G8: 0 | H8: 0 | I8: 0 | J8: 0 | K8: 0 | L8: 0 | M8: 0 | N8: 0 | O8: 0 | P8: 222 | Q8: 0 | R8: #VALUE!
A9: ASD Cannery | C9: =+'NewHC&Census'!#REF! -> #REF! | D9: =+'NewHC&Census'!#REF! -> #REF! | E9: 0 | P9: 0 | Q9: 0 | R9: #VALUE!
A10: ASD MOD 3 | B10: 0 | C10: 30 | D10: 0 | E10: 0 | F10: 0 | G10: 0 | H10: 0 | I10: 0 | J10: 0 | K10: 0 | L10: 0 | M10: 0 | N10: 0 | O10: 0 | P10: 30 | Q10: 0 | R10: #VALUE!
B11: 0 | C11: 0 | D11: 0 | E11: 0 | F11: 0 | G11: 0 | H11: 0 | I11: 0 | J11: 0 | K11: 0 | L11: 0 | M11: 0 | N11: 0 | O11: 0 | P11: 0 | Q11: 0 | R11: #VALUE!
B12: 0 | C12: 0 | D12: 0 | E12: 0 | F12: 0 | G12: 0 | H12: 0 | I12: 0 | J12: 0 | K12: 0 | L12: 0 | M12: 0 | N12: 0 | O12: 0 | P12: 0 | Q12: 0 | R12: #VALUE!
A13: ASD WRP-UNIV. AVE | B13: 0 | C13: 0 | D13: 0 | E13: 0 | F13: 0 | G13: 0 | H13: 0 | I13: 0 | J13: 0 | K13: 0 | L13: 0 | M13: 0 | N13: 0 | O13: 0 | P13: 0 | Q13: 0 | R13: #VALUE!
A14: CFCF | B14: 2734 | C14: 0 | D14: 0 | F14: 0 | G14: 0 | H14: 0 | I14: 0 | J14: 0 | K14: 0 | L14: 3 | M14: 0 | N14: 0 | O14: 0 | P14: 2737 | Q14: (2)HAHN,(1)NAZ | R14: #VALUE!
A15: DC-DETENTION CENTER | B15: 1070 | C15: 0 | D15: 0 | E15: 0 | F15: 0 | G15: 0 | H15: 0 | I15: 0 | J15: 0 | K15: 0 | L15: 0 | M15: 0 | N15: 0 | O15: 0 | P15: 1070 | Q15: (1)A-TORR,(1)JEFF | R15: #VALUE!
A16: DC-PHSW | B16: 42 | C16: 3 | D16: 0 | E16: 0 | F16: 0 | G16: 0 | H16: 0 | I16: 0 | J16: 0 | K16: 0 | L16: 1 | M16: 1 | N16: 0 | O16: 0 | P16: 47 | Q16: ='NewHC&Census'!#REF! -> #REF! | R16: #VALUE!
A17: HOC | B17: 1487 | C17: 0 | D17: 0 | E17: 0 | F17: 0 | G17: 0 | H17: 0 | I17: 0 | J17: 0 | K17: 0 | L17: 0 | M17: 0 | N17: 1 | O17: 0 | P17: 1488 | Q17: (1)A-TORR | R17: #VALUE!
A18: PICC | B18: 994 | C18: 0 | D18: 48 | E18: 0 | F18: 0 | G18: 0 | H18: 0 | I18: 0 | J18: 0 | K18: 0 | L18: 1 | M18: 0 | N18: 0 | O18: 0 | P18: 1043 | Q18: (1)A-TORR | R18: #VALUE!
A19: RCF | B19: 0 | C19: 666 | D19: 0 | E19: 2 | F19: 0 | G19: 0 | H19: 0 | I19: 0 | J19: 0 | K19: 0 | L19: 0 | M19: 1 | N19: 0 | O19: 0 | P19: 669 | Q19: (1)NAZ | R19: #VALUE!
A20: Weekenders | B20: 1 | C20: 2 | D20: 0 | E20: 0 | F20: 0 | G20: 0 | H20: 0 | I20: 0 | J20: 0 | K20: 0 | L20: 0 | M20: 0 | N20: 0 | O20: 0 | P20: 3 | Q20: 0 | R20: #VALUE!
A21: PPS "In Facility" Count | B21: 6652 | C21: 701 | D21: 48 | E21: 2 | F21: 0 | G21: 0 | H21: 0 | I21: 0 | J21: 0 | K21: 0 | L21: 5 | M21: 2 | N21: 1 | O21: 0 | P21: =SUM(B21:O21) -> 7411 | Q21: 0 | R21: #VALUE!
N22: =SUM(B22:M22) -> 0 | P22: =SUM(P6:P21) -> 14822
A23: Total "In Facility" Count (Adults + Juv) | B23: 6700 | C23: 703 | D23: 7403 | F23: =SUM(F7:F22) -> 0 | G23: =SUM(G7:G22) -> 0 | H23: =SUM(H7:H22) -> 0 | I23: =SUM(I7:I22) -> 0 | K23: =SUM(K7:K22) -> 0 | L23: =SUM(L7:L22) -> 10 | M23: =SUM(M7:M22) -> 4
A24: Not in Facility Total | B24: 6 | C24: 2 | D24: 8
A25: PPS Headcount + NIF | B25: 6706 | C25: 705 | D25: 7411
A27: Other Jurisdiction | B27: 74 | C27: 3 | D27: 77
A28: PPS Headcount + NIF + OJ (Census) | B28: 7430 | C28: 823 | D28: 7488
B29: 0 | C29: 0 | D29: 0
A30: Out of County | B30: 0 | C30: 0 | D30: 0
A31: State DOC | B31: 0 | C31: 0 | D31: 0
D32: 2
A33: Delaware County | B33: 0 | C33: 0 | D33: 0
A34: Lehigh Co. | B34: 45 | C34: 1 | D34: 46
A35: CEC | B35: 279 | C35: 0 | D35: 279
A36: ROTH | B36: 35 | C36: 5 | D36: 40
A37: Total | B37: 7141 | C37: 714 | D37: 7855
B38: 0
B39: 0
B40: Total Pop | C40: Total Male | D40: Total Fem | E40: Total Juv | F40: M | G40: F | H40: TIF | I40: TIF M | J40: TIF F | K40: NIF M | L40: NIF F | M40: OCC | N40: OCC-M | O40: OCC-F | P40: Liberty-M | R40: Liberty-F | S40: DelCo | T40: OJM | U40: LehighF | V40: Lehigh-M | W40: CEC | X40: ROTH-M | Y40: ROTH-F
A41: =B2 -> 42337 | B41: 7855 | C41: =B37 -> 7141 | D41: =C37 -> 714 | E41: =SUM(F41:G41) -> 50 | F41: =D21 -> 48 | G41: =E21 -> 2 | H41: =D25 -> 7411 | I41: =B25 -> 6706 | J41: =C25 -> 705 | K41: =+B24 -> 6 | L41: =+C24 -> 2 | M41: =D31 -> 0 | N41: =B31 -> 0 | O41: =C31 -> 0 | P41: =B32 -> 0 | R41: =C32 -> 0 | T41: =B27 -> 74 | U41: =C34 -> 1 | V41: =B34 -> 45 | W41: =D35 -> 279 | X41: =B36 -> 35 | Y41: =C36 -> 5
A42: 344 | B42: 153
A43: =CONCATENATE("A",A42) -> A344 | B43: A153

A1: 0